URL,Запросы
https://www.kommersant.ru/doc/5504279,"война в абхазии, грузино-абхазская война, война в абхазии 1992-1993, грузино-абхазский конфликт 1992-1993, абхазия война, абхазская война"
https://www.kommersant.ru/doc/6011558,"магнус карлсен, магнус карлсон, карл магнус, норвежский шахматист по имени магнус, карлсен, карлсен магнус"
https://www.kommersant.ru/doc/5041429,"том сойер, том соер, том сойер автор, кто написал тома сойера, автор тома сойера, кто написал том сойер"
https://www.kommersant.ru/doc/1752484,"косыгин, алексей николаевич косыгин, косыгин алексей николаевич, косыгин алексей, косыгин алексей николаевич википедия, алексей косыгин"
https://www.kommersant.ru/doc/5303672,"программист, что делает программист, сколько зарабатывает программист, что делают программисты, програмист, программист зарплата"
https://www.kommersant.ru/doc/5988552,"венсан кассель, винсент кассель, кассель, кассель венсан, венсан кассель последние новости"
https://www.kommersant.ru/doc/6027746,"дом удовольствий фильм 2022, дом удовольствий фильм, дом удовольствий, дом удовольствий фильм 2022 отзывы, фильм дом удовольствий, дом удовольствий фильм 2023"
